<?xml version="1.0" encoding="UTF-8"?>
<policySet 
  xmlns="http://www.iese.fhg.de/esf/1.0/enforcementLanguage"
  xmlns:tns="http://www.iese.fhg.de/esf/1.0/enforcementLanguage"
  xmlns:t="http://www.iese.fhg.de/esf/1.0/time"
  xmlns:a="http://www.iese.fhg.de/esf/1.0/action" 
  xmlns:e="http://www.iese.fhg.de/esf/1.0/event"
  xmlns:mc="http://www.master-fp7.eu/mcalculus.xsd"
  xmlns:xsi="http://www.w3.org/2001/XMLSchema-instance"
  xsi:schemaLocation="
    http://www.iese.fhg.de/esf/1.0/base base-FhG.xsd
    http://www.iese.fhg.de/esf/1.0/action action-FhG.xsd
    http://www.iese.fhg.de/esf/1.0/event event-FhG.xsd
    http://www.iese.fhg.de/esf/1.0/enforcementLanguage enforcementLanguage-FhG.xsd
    http://www.master-fp7.eu/mcalculus.xsd mcalculus.xsd">

 <detectiveMechanism name="Detective1">
    <description>Alarm when not ack</description>
    <timestep amount="1" unit="MINUTES"/>
    <condition>
      <and>
        <before amount="6">
          <eventMatch action="QueryDebtorRequest">
            <e:paramMatch name="alreadyRequested" value="false"/>
          </eventMatch>
        </before>
        <not>
          <within amount="6">
            <eventMatch action="Ack"/>
          </within>
        </not>
      </and>
    </condition>
    <action name="alarm"/>
  </detectiveMechanism>
</policySet>
